{
  "schema_version": "entry-evidence-v0.1",
  "entry_type": "from_scratch",
  "definition_digest": "sha256:a8242601fb199672b7fe2f2cd4cb5a6ef442c915d4f47a938bd94ed6f64e58e9",
  "source_summary": {
    "kind": "design_interview",
    "source_ids": ["request-001", "answer-001"],
    "summary": "The approved design turns one bounded review cycle into a local Skill build.",
    "facts": [
      {
        "provenance": "preserved",
        "summary": "The user requested a bounded review cycle."
      },
      {
        "provenance": "proposed",
        "summary": "The candidate uses one Loop and stops before publication."
      }
    ]
  },
  "clarifications": [
    {
      "question_summary": "Should publication be included?",
      "answer_summary": "No; the approved scope ends at a local build.",
      "resolution": "resolved"
    }
  ],
  "candidate_review": {
    "classification": "one_loop_bounded_loop",
    "summary": "The reviewed candidate is one bounded Loop with local-build-only authority."
  },
  "approval": {
    "status": "approved",
    "scope": "local_artifact_and_evidence_build"
  }
}
